Question,Accent_Answer,Confident_Answer
What is k-Nearest Neighbors (k-NN)?,"""k-Nearest Neighbors (k-NN) is simple classification algorithm. It check k nearest data point and assign most common label. It good for pattern recognition, anomaly detection.""","""k-Nearest Neighbors (k-NN) is a non-parametric classification algorithm that assigns labels based on the majority class among the k-nearest data points. It is effective for pattern recognition and anomaly detection."""
What is the Difference Between Supervised and Unsupervised Learning?,"""Supervised learning use labeled data to learn input-output map, but unsupervised learning find pattern in data without label.""","""Supervised learning relies on labeled data to map inputs to outputs, while unsupervised learning works with unlabeled data to identify patterns and relationships within the dataset."""
What is Semi-Supervised Learning?,"""Semi-supervised learning mix small labeled data with big unlabeled data to train model better, need less label work.""","""Semi-supervised learning is a hybrid approach that combines a small amount of labeled data with a larger set of unlabeled data to enhance model performance while reducing the need for extensive labeling."""
What is Anomaly Detection in Machine Learning?,"""Anomaly detection is machine learning method to find data point that not normal. It used for fraud detection, network security, predictive maintenance.""","""Anomaly detection is a machine learning technique used to identify data points that significantly deviate from the norm. It is widely used in fraud detection, network security, and predictive maintenance."""
"What is One-Hot Encoding, and why is it used?","""One-hot encoding is way to change category data to number by make binary column for each category. It help model understand category data.""","""One-hot encoding is a method for converting categorical variables into numerical form by creating binary columns for each category. It ensures that machine learning models can process categorical data effectively."""
What is the Difference Between L1 and L2 Regularization?,"""L1 regularization (Lasso) make some weight zero, so it select important feature. L2 regularization (Ridge) make big weight smaller, stop overfitting but keep all feature.""","""L1 regularization (Lasso) promotes sparsity by driving some weights to zero, effectively performing feature selection. L2 regularization (Ridge) penalizes large weights but retains all features, preventing overfitting."""
What is a Gradient Descent Algorithm?,"""Gradient descent is step-by-step optimization method to reduce loss function by update model parameter in negative gradient direction, help learn fast.""","""Gradient descent is an iterative optimization algorithm used to minimize a loss function by updating model parameters in the direction of the negative gradient, ensuring efficient convergence."""
What are the different types of Gradient Descent?,"""Three main kind of gradient descent: (1) Batch Gradient Descent, use all data to compute gradient; (2) Stochastic Gradient Descent (SGD), update after each sample; (3) Mini-Batch Gradient Descent, update using small data batch, balance speed and accuracy.""","""The three primary types of gradient descent are: (1) Batch Gradient Descent, which computes gradients over the full dataset, (2) Stochastic Gradient Descent (SGD), which updates parameters per sample, and (3) Mini-Batch Gradient Descent, which balances efficiency by updating with small batches of data."""
What is the difference between Lasso and Ridge Regression?,"""Lasso regression (L1 regularization) make some weight zero, so it select feature. Ridge regression (L2 regularization) stop big weight but keep all feature, prevent overfitting.""","""Lasso regression (L1 regularization) enforces sparsity by shrinking some weights to zero, effectively performing feature selection. Ridge regression (L2 regularization) penalizes large weights without eliminating features, preventing overfitting while retaining all inputs."""
What is the Vanishing Gradient Problem? How do you solve it?,"""Vanishing gradient problem happen when gradient become too small in deep network, so lower layer not learn well. Solution include use ReLU, batch normalization, skip connection, and LSTM for sequence data.""","""The vanishing gradient problem arises when gradients shrink in deep networks, preventing lower layers from learning effectively. Solutions include using activation functions like ReLU, batch normalization, skip connections, and specialized architectures like LSTMs for sequential data."""
What is an Exploding Gradient Problem?,"""Exploding gradient problem happen when gradient become too big during backpropagation, make training unstable. Fix by gradient clipping, good weight initialization, batch normalization.""","""The exploding gradient problem occurs when gradients grow excessively large during backpropagation, leading to instability. It is addressed using gradient clipping, proper weight initialization, and batch normalization."""
"What is XGBoost, and why is it so effective?","""XGBoost is fast, accurate boosting algorithm. It use regularization, parallel computing, and handle missing value well, so it very strong for prediction.""","""XGBoost is an advanced gradient boosting algorithm optimized for speed and accuracy. It incorporates regularization, parallel processing, and built-in missing value handling, making it highly effective in predictive modeling."""
"You train a machine learning model, and it performs well on the training data but poorly on the test data. What would you do next?","""This show overfitting. To fix, I try L1/L2 regularization, get more training data, do data augmentation, make model simpler, or use dropout in neural network.""","""This suggests overfitting. To address it, I would explore regularization techniques (L1/L2), try collecting more training data, use data augmentation, simplify the model, or apply dropout in neural networks."""
"Your model is performing well overall, but it performs very poorly on a specific subset of the data. How would you handle this?","""This mean class imbalance or data distribution change. I check error, look feature importance, use data augmentation, try stratified sampling, or make special model for affected data.""","""This suggests either class imbalance or a distribution shift. I would conduct an error analysis, check feature importance, consider data augmentation, apply stratified sampling, or train a targeted model for the affected subset."""
Your classification model has a high accuracy but is failing to detect rare cases (false negatives are high). What steps would you take?,"""This mean class imbalance. I change decision threshold, adjust loss function weight, use oversampling like SMOTE, or try ensemble method to improve recall.""","""This indicates class imbalance. I would adjust the decision threshold, re-weight the loss function, apply techniques like SMOTE for oversampling, or experiment with ensemble methods to improve recall."""
Your deep learning model is training extremely slowly. How would you optimize the training process?,"""I check bottleneck, use mini-batch gradient descent, do mixed-precision training, tune hyperparameter like batch size, learning rate, or use GPU/TPU for faster training.""","""I would analyze bottlenecks, use mini-batch gradient descent, apply mixed-precision training, tune hyperparameters like batch size and learning rate, or leverage distributed training with GPUs/TPUs."""
"Your model is making predictions, but they seem completely random. What debugging steps would you take?","""Random prediction mean big problem in preprocessing, feature engineering, or model design. I check data correctness, label encoding, loss function, and feature scaling.""","""Random predictions suggest a major issue in preprocessing, feature engineering, or model architecture. I would verify data integrity, check label encoding, inspect loss convergence, and ensure correct feature scaling."""
"You deploy a model, and its performance degrades over time. What could be the cause, and how would you address it?","""This show data drift (input change) or concept drift (relation change). I add monitoring, use adaptive learning, and retrain model often.""","""This suggests data drift (changing input distribution) or concept drift (changing relationships). I would implement continuous monitoring, use adaptive learning techniques, and retrain the model periodically."""
"Your team wants to move from a simple logistic regression model to a deep learning model, but you’re unsure if it's necessary. How would you decide?","""I check if model accuracy and interpretability is enough. If deep learning give much better result, is worth compute cost, and data is big, I switch.""","""I would evaluate if the current model meets accuracy and interpretability needs. If deep learning offers significant improvements, justifies computational costs, and the dataset is large enough, I would consider transitioning."""
You’re given a dataset with millions of features. How would you determine which features to keep?,"""I use feature selection like PCA to reduce dimension, mutual information to rank feature, or L1 regularization to remove useless feature.""","""I would apply feature selection techniques such as PCA for dimensionality reduction, mutual information for ranking features, and L1 regularization to eliminate non-contributory features."""
You need to build a real-time machine learning system for fraud detection. What key challenges would you anticipate?,"""Main challenge is making inference fast, handling concept drift, fixing class imbalance, making model easy to understand, and keeping monitoring strong.""","""Key challenges include optimizing inference latency, handling concept drift, addressing class imbalance, ensuring model interpretability, and maintaining robust monitoring systems."""
"Your model’s precision is high, but recall is low. How would you adjust it?","""I lower decision threshold, reweight loss function, use recall metric, and try ensemble method to improve recall.""","""I would lower the decision threshold, reweight the loss function, use recall-focused evaluation metrics, and experiment with ensemble methods to improve recall."""
"Your model predicts continuous values, but the predictions are often out of a valid range. What would you do?","""I put limit on output, clip prediction, normalize target, use good loss function, and try activation like sigmoid or ReLU to keep output valid.""","""I would apply output constraints, clip predictions, normalize targets, use proper loss functions, and consider activation functions like sigmoid or ReLU to maintain valid outputs."""
You need to explain your machine learning model’s decisions to a non-technical audience. How would you approach this?,"""I use simple model when possible, use SHAP or LIME to see feature importance, and show result with clear visual explain.""","""I would use interpretable models where possible, leverage tools like SHAP or LIME for feature importance, and present results using clear, visual storytelling tailored to the audience."""
You want to improve the generalization of a deep learning model. What techniques would you use?,"""To make model generalize better, I use data augmentation, dropout, batch normalization, L1/L2 regularization, and early stopping to avoid overfit.""","""To enhance generalization, I would use data augmentation, dropout, batch normalization, L1/L2 regularization, and implement early stopping to prevent overfitting."""
You need to deploy a machine learning model on a mobile device. What constraints would you consider?,"""To put model on mobile, I make it small and fast using quantization, pruning, distillation, and edge computing.""","""Deployment on mobile requires optimizing model size, inference latency, and power efficiency. I would use quantization, pruning, distillation, and edge computing optimizations."""
Your model performs well in offline evaluation but fails in production. What might be causing this?,"""Possible problem is data drift, feature leakage, unseen data, or preprocessing not same in training and real use.""","""Potential causes include data drift, feature leakage, unseen distributions, or mismatches in preprocessing pipelines between training and production environments."""
Your model has high variance and low bias. How would you fix it?,"""High variance mean overfitting. I use L1/L2 regularization, add more training data, use dropout for deep model, or pick simpler model to fix.""","""High variance suggests overfitting. I would apply regularization (L1/L2), increase training data, use dropout for deep models, or switch to a simpler model to reduce variance."""
You are asked to develop a model that makes predictions but also provides uncertainty estimates. How would you do this?,"""I try Bayesian neural network, Monte Carlo dropout, quantile regression, or ensemble method like bootstrap aggregation to estimate uncertainty.""","""I would explore Bayesian neural networks, Monte Carlo dropout, quantile regression, or ensemble methods like bootstrap aggregation to provide uncertainty estimates."""
Your image classification model is mistakenly classifying cats as dogs. What debugging steps would you take?,"""First, I check data quality and label, analyze class imbalance, visualize feature activation, and use interpretability method like Grad-CAM to see misclassification reason.""","""I would first check data quality and labeling, analyze class imbalance, visualize feature activations, and investigate model interpretability techniques like Grad-CAM to understand misclassifications."""
Your NLP model generates biased predictions. How would you mitigate this?,"""To reduce bias, I check training data for imbalance, use counterfactual fairness, fine-tune model with adversarial debiasing, and use interpretability tool to find bias.""","""To mitigate bias, I would audit training data for imbalances, apply counterfactual fairness techniques, fine-tune the model using adversarial debiasing, and leverage interpretability tools to detect bias."""
Your object detection model is slow in real-time applications. How would you speed it up?,"""I optimize model with quantization, pruning, and knowledge distillation. Also, I use efficient architecture like YOLO or MobileNet and speed up with GPU.""","""I would optimize the model using quantization, pruning, and knowledge distillation. Additionally, I would use efficient architectures like YOLO or MobileNet and leverage GPU acceleration."""
You need to design a recommendation system for an e-commerce website. What factors would you consider?,"""I consider user behavior, collaborative filtering, content-based filtering, cold-start issue, scalability, and real-time personalization to make better recommendation.""","""I would consider user behavior, collaborative filtering, content-based filtering, cold-start problems, scalability, and real-time personalization to improve recommendations."""
Your time series forecasting model starts showing increasing error over time. What might be wrong?,"""If error increase, maybe concept drift or compounding error. I check autocorrelation, use rolling window forecast, retrain often, and try hierarchical time series model.""","""Increasing error suggests concept drift or compounding errors. I would analyze autocorrelation, apply rolling window forecasts, retrain periodically, and consider using hierarchical time series models."""
"You have a small dataset, but you need to train a high-performing deep learning model. What would you do?","""I use transfer learning with pretrained model, do data augmentation, make synthetic data, and try semi-supervised learning.""","""I would leverage transfer learning with pretrained models, apply data augmentation, use synthetic data generation techniques, and explore semi-supervised learning."""
"Your team is debating whether to use a tree-based model (e.g., XGBoost) or a deep learning model. How would you decide?","""I check dataset size, feature complexity, interpretability, and compute need. Tree model work well for structured data, deep learning better for complex data with many features.""","""I would evaluate dataset size, feature complexity, interpretability, and computational resources. Tree-based models excel on structured data, while deep learning is better for complex, high-dimensional data."""
Your model is highly accurate but does not generalize well to new data. What steps would you take?,"""To generalize better, I use dropout, L1/L2 regularization, add more diverse data, do cross-validation, and make sure data augmentation work well.""","""To improve generalization, I would apply dropout, L1/L2 regularization, increase data diversity, use cross-validation, and ensure data augmentation is used effectively."""
Your autonomous vehicle perception system struggles with edge cases like extreme weather. How would you improve it?,"""I use different real-world data, apply domain adaptation, fine-tune with synthetic dataset, and do adversarial training to make model strong in extreme case.""","""I would incorporate diverse real-world data, use domain adaptation techniques, fine-tune with synthetic datasets, and apply adversarial training to improve robustness under extreme conditions."""
Your chatbot provides irrelevant responses to user queries. How would you debug this?,"""I check why intent recognition fail, improve training data, make better embeddings, change temperature setting for response diversity, and try reinforcement learning for context.""","""I would analyze intent recognition failures, refine training data, improve embeddings, adjust temperature settings for response diversity, and test reinforcement learning for better contextual understanding."""
You need to explain why your model rejected a loan application. How would you make your model interpretable?,"""I use SHAP value, LIME, decision tree, and feature attribution to make model explain clear and follow regulation.""","""I would apply SHAP values, LIME, decision trees, and feature attribution techniques to provide transparent explanations while ensuring compliance with regulatory standards."""
"You deploy a model, and users start gaming it (e.g., SEO spam, recommendation system exploits). How would you respond?","""I do adversarial testing, watch user interaction, apply anomaly detection, and keep updating model to stop system abuse.""","""I would implement adversarial testing, monitor user interactions, apply anomaly detection, and continuously update the model to prevent system manipulation."""
Your team wants to switch from batch learning to online learning. What challenges would you anticipate?,"""Challenge include data drift, making compute efficient, handling noisy data, keeping model stable, and making good update system.""","""Challenges include data drift adaptation, computational efficiency, handling noisy data, ensuring stability, and developing robust incremental update mechanisms."""
Your model's performance suddenly drops in production but works fine in training. How would you diagnose the issue?,"""I check for data drift, concept drift, mismatch in data processing from training to production, feature pipeline problem, and real-time inference delay.""","""I would check for data drift, concept drift, mismatched data preprocessing between training and production, feature pipeline inconsistencies, and potential issues with real-time inference latency."""
You need to reduce inference time without significantly sacrificing accuracy. What techniques would you use?,"""I use quantization, pruning, knowledge distillation, make model simpler (replace complex layer with easy one), and use fast hardware (TensorRT, ONNX Runtime).""","""I would apply quantization, pruning, knowledge distillation, optimize model architecture (e.g., replacing complex layers with efficient alternatives), and leverage hardware acceleration (e.g., TensorRT, ONNX Runtime)."""
"You are asked to detect fraudulent transactions, but fraud cases are extremely rare in your dataset. How would you handle this class imbalance?","""I use SMOTE to oversample minority class, try cost-sensitive learning, use anomaly detection, and train ensemble like XGBoost with special loss for imbalance.""","""I would apply SMOTE (Synthetic Minority Over-sampling Technique), try cost-sensitive learning, use anomaly detection models, and explore ensemble methods like XGBoost with customized loss functions for imbalanced data."""
Your machine learning model is deployed in a high-stakes medical application. How would you ensure its reliability and fairness?,"""I make strong validation with real medical data, check fairness, use explainable AI like SHAP/LIME, monitor model drift, and follow rule like HIPAA and FDA.""","""I would implement rigorous validation with real-world medical data, conduct fairness audits, apply explainability methods like SHAP/LIME, ensure model drift monitoring, and comply with regulatory standards like HIPAA and FDA guidelines."""
Your deep learning model overfits even after using dropout and regularization. What else would you try?,"""I add different data, do data augmentation, stop training early, try new architecture, make model smaller, and tune hyperparameter to make model generalize better.""","""I would increase dataset diversity, apply data augmentation, use early stopping, experiment with a different architecture, reduce model complexity, and fine-tune hyperparameters to improve generalization."""
Your model has a high accuracy but performs poorly on real-world data. How would you address this?,"""I check domain shift, make sure feature processing same, apply domain adaptation, collect more real-world data, and use active learning to improve step by step in production.""","""I would investigate domain shift, ensure feature engineering consistency, apply domain adaptation techniques, collect more real-world data, and use active learning to iteratively improve model performance in production."""