Question,Accent_Answer,Confident_Answer
What is the difference between an abstract class and an interface?,"""Abstract class allow shared code and method implementations, while interface enforce contract without implementation. Abstract class best for common behavior across subclasses, whereas interface good for define capability that many unrelated class can implement.""","""An abstract class allows shared code and method implementations, while an interface enforces a contract without implementation. Abstract classes are best for common behavior across subclasses, whereas interfaces are ideal for defining capabilities that multiple unrelated classes can implement."""
"How would you optimize a database query that is running slowly?

","""To optimize slow query, first I analyze execution plan to find bottlenecks. I apply indexing, optimize joins, reduce unnecessary data retrieval, and ensure proper database normalization. If need, I also consider caching strategy.""","""To optimize a slow query, I first analyze the execution plan to identify bottlenecks. I apply indexing, optimize joins, reduce unnecessary data retrieval, and ensure proper database normalization. If needed, I also consider caching strategies."""
Can you explain the CAP theorem?,"""CAP theorem say distributed database cannot provide consistency, availability, and partition tolerance at same time. System must make trade-off, like prioritize consistency for banking application or availability for social media platform.""","""The CAP theorem states that a distributed database cannot simultaneously provide consistency, availability, and partition tolerance. Systems must make trade-offs, such as prioritizing consistency in banking applications or availability in social media platforms."""
How do you handle conflicts in a team setting?,"""I handle conflict by listen actively to all, find root cause, and help discussion to reach resolution. I focus on collaboration and ensure all voice are heard to keep productive work environment.""","""I handle conflicts by actively listening to all parties, identifying the root cause, and facilitating a constructive discussion to reach a resolution. I focus on collaboration and ensure all voices are heard to maintain a productive work environment."""
"What are design patterns, and can you give an example?","""Design pattern are proven solution to common software design problem. For example, Singleton pattern make sure class have only one instance and provide global access. It used for configuration management, logging.""","""Design patterns are proven solutions to recurring software design problems. For example, the Singleton pattern ensures a class has a single instance and provides global access to it. It’s commonly used for configuration management and logging."""
What is the difference between multithreading and multiprocessing?,"""Multithreading allow multiple threads in single process to share memory and run parallel, while multiprocessing create separate process with own memory. Multithreading good for I/O-bound tasks, multiprocessing better for CPU-bound task.""","Multithreading allows multiple threads within a single process to share memory and run concurrently, while multiprocessing creates separate processes with their own memory space. Multithreading is useful for I/O-bound tasks, while multiprocessing is better for CPU-bound tasks.""
"
How do you handle memory management in a language like C?,"""In C, memory management need manual allocation with malloc and free. I follow best practice like avoid memory leak, use valgrind for debug, and make sure proper pointer handling to prevent segmentation fault.""","""In C, memory management involves manual allocation with malloc and deallocation with free. I follow best practices like avoiding memory leaks, using valgrind for debugging, and ensuring proper pointer handling to prevent segmentation faults."""
What is the purpose of a load balancer?,"""Load balancer distribute traffic across many servers to use resource better, avoid overload, and improve scalability, reliability. Common type include round-robin, least connections, and IP hash-based balancing.""","""A load balancer distributes incoming traffic across multiple servers to ensure optimal resource utilization, prevent overload, and improve scalability and reliability. Common types include round-robin, least connections, and IP hash-based balancing."""
How do you approach debugging a segmentation fault?,"""To debug segmentation fault, I check for null dereference, invalid memory access, buffer overflow. I use gdb to analyze core dump, valgrind to find memory leak, and review code changes step by step.""","""To debug a segmentation fault, I check for null dereferences, invalid memory accesses, and buffer overflows. I use gdb to analyze core dumps, valgrind to detect memory leaks, and systematically review recent code changes to identify the issue."""
Can you explain the difference between a linked list and an array?,"""Linked list dynamically allocated, allow efficient insertion, deletion. Array have fixed size but provide faster index access. Array better for random access, linked list better for dynamic resizing.""","""A linked list is dynamically allocated and supports efficient insertions and deletions, while an array has a fixed size and provides faster indexed access. Arrays are better for random access, whereas linked lists excel at dynamic resizing."""
What is the difference between a process and a thread?,"""Process is independent execution unit with own memory, while thread is lightweight execution unit inside process that share memory. Threads more efficient for parallel execution, process better for isolation.""","""A process is a self-contained execution unit with its own memory space, while a thread is a lightweight unit of execution within a process that shares memory. Threads are more efficient for parallel execution within a single application, whereas processes provide better isolation.""
"
"What is a deadlock, and how can you prevent it?","""Deadlock happen when two or more process or threads wait forever for each other to release resource. To prevent, avoid circular wait, acquire resource in fixed order, use timeout, implement deadlock detection.""","""A deadlock occurs when two or more threads or processes wait indefinitely for resources held by each other. Prevention strategies include avoiding circular waits, acquiring resources in a fixed order, using timeouts, and implementing a deadlock detection mechanism."""
What are the key differences between SQL and NoSQL databases?,"""SQL database use structured table, predefined schema, best for relational data. NoSQL database like document store, key-value store allow schema flexibility, horizontal scalability, better for large, unstructured, fast-changing data.""","""SQL databases use structured tables and predefined schemas, making them ideal for relational data. NoSQL databases, such as document and key-value stores, offer schema flexibility and horizontal scalability, making them better for large, unstructured, or rapidly changing data."""
What is Machine Learning?,"""Machine learning is AI field where computer learn pattern from data and make prediction or decision without explicit programming. It involve training model on labeled or unlabeled data to recognize trend, improve performance.""","""Machine learning is a field of artificial intelligence that enables computers to learn patterns from data and make predictions or decisions without explicit programming. It involves training models on labeled or unlabeled data to recognize trends and improve performance over time."""
Mention the difference between Data Mining and Machine Learning.,"""Data mining find pattern, insight from big dataset, while machine learning focus on build model to predict based on data. Data mining often used as preprocessing step for machine learning.""","""Data mining is the process of discovering patterns and insights from large datasets, while machine learning focuses on building models that can make predictions based on data. Data mining is often used as a preprocessing step for machine learning applications."""
What is ‘Overfitting’ in Machine Learning?,"""Overfitting happen when machine learning model learn too much from training data, including noise, so it not work well on new data. Model have high accuracy on training data but low accuracy on test data.""","""Overfitting occurs when a machine learning model learns patterns, including noise, from training data too well, leading to poor generalization on unseen data. This results in high accuracy on training data but low accuracy on test data."""
Why does overfitting happen?,"""Overfitting happen when model too complex for data, so it learn noise instead of real pattern. Cause include too many parameters, too little training data, no proper regularization.""","""Overfitting occurs when a model is too complex relative to the available data, leading it to capture noise rather than true patterns. Causes include excessive model parameters, insufficient training data, and lack of proper regularization techniques."""
How can you avoid overfitting?,"""To avoid overfitting, I use technique like increase training data, apply regularization (L1/L2), use dropout in neural network, and apply cross-validation to make sure model generalize well.""","""To avoid overfitting, I use techniques such as increasing training data, applying regularization (L1/L2), using dropout in neural networks, and implementing cross-validation to ensure the model generalizes well to unseen data."""
What is inductive machine learning?,"""Inductive machine learning is method where model learn general pattern from specific training data. It analyze example and find general rule to apply for new data.""","""Inductive machine learning is a method where models learn general patterns from specific training data. The system analyzes examples and derives a general rule or function that can be applied to unseen data for predictions."""
What are the five popular algorithms of Machine Learning?,"""Five popular machine learning algorithms are Decision Trees, Support Vector Machine (SVM), Neural Networks, K-Means Clustering, Linear Regression. Each used for different purpose, like classification, clustering, regression.""","""The five popular machine learning algorithms are Decision Trees, Support Vector Machines (SVM), Neural Networks, K-Means Clustering, and Linear Regression. Each serves different purposes, such as classification, clustering, and regression."""
What are the different algorithm techniques in Machine Learning?,"""Machine learning techniques include supervised learning, unsupervised learning, semi-supervised learning, and reinforcement learning. Supervised learning use labeled data, while unsupervised learning find pattern in unlabeled data.""","""Machine learning techniques include supervised learning, unsupervised learning, semi-supervised learning, and reinforcement learning. Supervised learning uses labeled data, while unsupervised learning finds patterns in unlabeled data."""
What are the three stages to build the hypotheses or model in Machine Learning?,"""Three stages for build machine learning model are data preprocessing (clean and prepare data), model training (learn from data), and model evaluation (check performance and fine-tune).""","""The three stages of building a machine learning model are data preprocessing (cleaning and preparing data), model training (learning from data), and model evaluation (assessing performance and fine-tuning)."""
What is the standard approach to supervised learning?,"""Standard approach for supervised learning is train model using labeled data, optimize to minimize error, then use for predict output on new, unseen input.""","""The standard approach to supervised learning is training a model using labeled data, optimizing it to minimize error, and then using it to predict outputs for new, unseen inputs."""
What is Unsupervised Learning?,"""Unsupervised learning is machine learning method where model learn from unlabeled data, find hidden pattern, structure without predefined output. Clustering, dimensionality reduction common technique in unsupervised learning.""","""Unsupervised learning is a machine learning approach where models learn from unlabeled data, identifying hidden patterns and structures without predefined outputs. Clustering and dimensionality reduction are common techniques used in unsupervised learning."""
What is the difference between Classification and Regression?,"""Classification is machine learning task that predict category label, like decide if email is spam or not. Regression predict continuous value, like estimate house price. Both are supervised learning type.""","""Classification is a machine learning task that predicts categorical labels, such as determining whether an email is spam or not, while regression predicts continuous values, such as estimating house prices. Both are forms of supervised learning."""
What is Reinforcement Learning?,"""Reinforcement learning is machine learning method where agent learn best action by interact with environment, get reward or penalty for action. It used in robotics, game playing, autonomous system.""","""Reinforcement learning is a machine learning approach where an agent learns optimal behaviors by interacting with an environment and receiving rewards or penalties based on its actions. It is commonly used in robotics, game playing, and autonomous systems."""
What is a Neural Network?,"""Neural network is machine learning model like structure of human brain, with layers of neuron that process data, find pattern. It important for deep learning.""","""A neural network is a machine learning model inspired by the structure of the human brain, consisting of layers of interconnected neurons that process data and extract patterns. It is fundamental to deep learning applications."""
What is a Confusion Matrix in Machine Learning?,"""Confusion matrix is table to check classification model performance, show number of correct and incorrect predictions, include true positive, false positive, true negative, false negative.""","""A confusion matrix is a table that evaluates the performance of classification models by displaying the number of correct and incorrect predictions, including metrics such as true positives, false positives, true negatives, and false negatives."""
What is the Bias-Variance Tradeoff in Machine Learning?,"""Bias-variance tradeoff is key idea in machine learning about balance between underfitting (high bias) and overfitting (high variance). High bias mean model too simple, not learn important pattern. High variance mean model too sensitive to noise.""","""The bias-variance tradeoff is a fundamental concept in machine learning that describes the balance between underfitting (high bias) and overfitting (high variance). A model with high bias is too simple and fails to capture key patterns, whereas high variance makes it too sensitive to noise in the training data."""
What is Feature Engineering in Machine Learning?,"""Feature engineering is process to select, transform, or create input variable to make model more accurate. It important for improve generalization.""","""Feature engineering is the process of selecting, transforming, or creating new input variables to enhance a model’s predictive performance. It plays a crucial role in improving accuracy and generalization."""
"What is Dimensionality Reduction, and why is it important?","""Dimensionality reduction is technique to reduce number of input features in dataset but keep important information. It help improve computation, reduce noise, stop overfitting when too many features.""","""Dimensionality reduction is a technique used to reduce the number of input features in a dataset while preserving essential information. It helps improve computational efficiency, reduce noise, and prevent overfitting in high-dimensional data."""
What is Principal Component Analysis (PCA)?,"""Principal Component Analysis (PCA) is technique for dimensionality reduction that change data into lower dimension, but keep as much variance as possible. It help make data analysis more efficient.""","""Principal Component Analysis (PCA) is a dimensionality reduction technique that transforms data into a lower-dimensional space while preserving as much variance as possible. It identifies the most important features, making data analysis more efficient."""
"What is Cross-Validation, and why is it used?","""Cross-validation is technique to check machine learning model by split dataset into multiple training, testing parts. It make performance estimate more reliable, help prevent overfitting.""","""Cross-validation is a technique used to evaluate a machine learning model by partitioning the dataset into multiple training and testing subsets. It ensures more reliable performance estimates and prevents overfitting."""
"What is Gradient Descent, and how does it work?","""Gradient descent is optimization algorithm to minimize model loss function by update parameter step by step in direction of steepest decrease. It help model learn from data well.""","""Gradient descent is an optimization algorithm used to minimize a model’s loss function by iteratively adjusting its parameters in the direction of the steepest decrease. It helps machine learning models learn from data effectively."""
What are Hyperparameters in Machine Learning?,"""Hyperparameters are settings that control how machine learning model train, like learning rate, number of layers, regularization strength. They set before training, affect model performance a lot.""","""Hyperparameters are configuration settings that control the training process of a machine learning model, such as learning rate, number of layers, and regularization strength. They are set before training and significantly impact model performance."""
What is Regularization in Machine Learning?,"""Regularization is method to stop overfitting by add penalty to complex model. Common type include L1 regularization (Lasso), which make some coefficient zero, and L2 regularization (Ridge), which reduce big coefficient value.""","""Regularization is a technique used to prevent overfitting by adding penalties to a model’s complexity. Common approaches include L1 regularization (Lasso), which encourages sparsity, and L2 regularization (Ridge), which reduces large coefficient values."""
What is a Loss Function in Machine Learning?,"""Loss function measure difference between predicted and real value in machine learning model. Goal of training is to make loss smaller to improve accuracy.""","""A loss function quantifies the difference between the predicted and actual values in a machine learning model. The objective of training is to minimize this loss to enhance model accuracy."""
What is the Difference Between Parametric and Non-Parametric Models?,"""Parametric model have fixed number of parameter, assume specific function form. Non-parametric model more flexible, adjust to data without fixed structure.""","""Parametric models have a fixed number of parameters and assume a specific functional form, whereas non-parametric models are more flexible and can adapt to data without assuming a predefined structure."""
What is Transfer Learning in Machine Learning?,"""Transfer learning is method where model trained on one task used for another related task, reusing learned feature. It useful when labeled data is small.""","""Transfer learning is a technique where a model trained on one task is adapted for another related task, leveraging previously learned features. It is particularly useful when there is limited labeled data available."""
What is an Ensemble Learning Technique?,"""Ensemble learning is machine learning approach that combine multiple model to make prediction better, more robust. Popular method include bagging, boosting, stacking.""","""Ensemble learning is a machine learning approach that combines multiple models to enhance prediction accuracy and robustness. Popular techniques include bagging, boosting, and stacking."""
What is the Difference Between Bagging and Boosting?,"""Bagging train many model independently and combine output to reduce variance, while boosting build model one after another, each fixing mistake of previous to reduce bias.""","""Bagging trains multiple models independently and combines their outputs to reduce variance, while boosting builds models sequentially, each correcting the mistakes of the previous ones to reduce bias."""
What are the Challenges of Machine Learning?,"""Machine learning have many challenge, like bad data quality, overfitting, hard to interpret result, limit in computation, and ethical problem. Solve these challenge important for good model.""","""Machine learning faces several challenges, including poor data quality, overfitting, lack of interpretability, computational constraints, and ethical concerns. Addressing these challenges is crucial for building effective models."""
What is Online Learning in Machine Learning?,"""Online learning is machine learning method where model update itself when new data come, so it change and improve over time. It used in real-time application like fraud detection, recommendation system.""","""Online learning is a machine learning approach where a model continuously updates itself as new data arrives, allowing it to adapt dynamically. It is widely used in real-time applications such as fraud detection and recommendation systems."""
What is the Curse of Dimensionality in Machine Learning?,"""Curse of dimensionality mean problem when data have too many feature. When number of feature increase, data become sparse, and model find harder to generalize well.""","""The curse of dimensionality describes the difficulties that occur when working with high-dimensional data. As the number of features increases, data points become sparse, making it harder for models to generalize effectively."""
What is a Perceptron in Machine Learning?,"""Perceptron is simple neural network unit use for binary classification. It take input, multiply by weight, pass through activation function. It basic part of deep learning model.""","""A perceptron is a basic neural network unit used for binary classification. It processes weighted inputs through an activation function, making it a fundamental building block of deep learning models."""
What is a Convolutional Neural Network (CNN)?,"""Convolutional Neural Network (CNN) is deep learning model for image processing. It use convolution layer to find pattern in image, good for object detection, classification.""","""A Convolutional Neural Network (CNN) is a specialized deep learning architecture designed for image processing. It uses convolutional layers to detect spatial hierarchies in images, making it highly effective for tasks such as object detection and image classification."""
What is a Recurrent Neural Network (RNN)?,"""Recurrent Neural Network (RNN) is deep learning model for sequence data, like text, time series. It have connection to remember past, useful for speech recognition, machine translation.""","""A Recurrent Neural Network (RNN) is a deep learning architecture designed for sequential data, such as time series or text. It has connections that allow it to retain past information, making it suitable for tasks like speech recognition and machine translation."""
What is Reinforcement Learning?,"""Reinforcement learning is machine learning type where agent learn best action by interact with environment, get reward or penalty. It used in robot, game, decision making.""","""Reinforcement learning is a machine learning paradigm in which an agent learns optimal behavior by interacting with an environment and receiving rewards or penalties. It is widely used in robotics, gaming, and decision-making applications."""
What is a Markov Decision Process (MDP)?,"""Markov Decision Process (MDP) is math way to model decision in random environment, used in reinforcement learning. It have state, action, transition, reward, and policy.""","""A Markov Decision Process (MDP) is a mathematical framework used in reinforcement learning to model decision-making in stochastic environments. It consists of states, actions, transition probabilities, rewards, and policies."""
What is a Support Vector Machine (SVM)?,"""Support Vector Machine (SVM) is strong supervised learning algorithm that find best boundary between class by make margin biggest. It good for classification, regression, work well in high dimension.""","""A Support Vector Machine (SVM) is a powerful supervised learning algorithm that identifies the optimal decision boundary between classes by maximizing the margin. It is effective for both classification and regression tasks, especially in high-dimensional spaces."""
What is a Decision Tree in Machine Learning?,"""Decision Tree is machine learning model that predict by follow rule step by step based on input feature. It popular for classification, regression because easy to understand.""","""A Decision Tree is a machine learning model that predicts outcomes by following a sequence of decision rules based on input features. It is widely used for classification and regression due to its interpretability and flexibility."""
What is Random Forest?,"""Random Forest is ensemble method that make many decision tree, combine result to improve accuracy, make model more strong, less overfitting.""","""Random Forest is an ensemble learning algorithm that constructs multiple decision trees and aggregates their outputs to enhance accuracy and robustness while reducing overfitting."""
