interview_round,hedged_or_confident,question_1,question_1_category,question_1_response,question_1_score,question_1_score_reasoning,question_2,question_2_category,question_2_response,question_2_score,question_2_score_reasoning,question_3,question_3_category,question_3_response,question_3_score,question_3_score_reasoning,question_4,question_4_category,question_4_response,question_4_score,question_4_score_reasoning,question_5,question_5_category,question_5_response,question_5_score,question_5_score_reasoning,question_6,question_6_category,question_6_response,question_6_score,question_6_score_reasoning,question_7,question_7_category,question_7_response,question_7_score,question_7_score_reasoning,question_8,question_8_category,question_8_response,question_8_score,question_8_score_reasoning,question_9,question_9_category,question_9_response,question_9_score,question_9_score_reasoning,question_10,question_10_category,question_10_response,question_10_score,question_10_score_reasoning,final_answer,final_answer_reasoning
1,Hedged,How do you handle stress and tight deadlines?,Educational Background: Does the candidate have the appropriate educational qualifications or training for this position?,"""I try to stay organized, prioritize tasks, and communicate effectively with my team to manage deadlines.""",2,"Rating: 2 - Below Requirements

Reasoning: While the response demonstrates an understanding of time management and teamwork, it does not provide any information about the candidate's educational background or qualifications. The candidate does not mention any specific education or training that would be relevant to the position. As such, the response is lacking in clarity and depth regarding the educational requirements for the position.",What do you consider your biggest professional achievement?,Job/Organizational Fit: Has the candidate acquired similar skills or qualifications through past work experiences?,"""One of my biggest achievements was contributing to a project that had a meaningful impact.""",1,"Rating: 1 - Significant Gap

Reasoning: The response provided is vague and does not give enough information to evaluate the candidate's job/organizational fit in terms of past work experiences and acquired skills. The statement ""One of my biggest achievements was contributing to a project that had a meaningful impact"" does not provide any specific details about the nature of the project, the skills utilized, or how it connects to the position being applied for. To improve this response, the candidate should provide concrete examples of the skills they have acquired and how those skills are relevant to the job they are applying for.",What’s your leadership style?,Problem Solving: Did the candidate display the ability to react to a situation and devise a strategy?,"""I try to be supportive and collaborative, helping team members do their best work.""",2,"Rating: 2 - Below Requirements.

Reasoning: While the response indicates a positive attitude and a desire for teamwork, it does not provide specific details about the candidate's ability to react to a situation and devise a strategy. The candidate does not give examples of problem-solving skills or describe a specific strategy they would employ when faced with a challenging situation. The answer lacks clarity and depth, thus earning a rating of 2.",How would you implement authentication in a web application?,Verbal Communication: How were the candidate’s communication skills during the interview?,"""I’d use OAuth or JWT, depending on the use case, and ensure secure password hashing.""",5,"Rating: 5 - Far Exceeds Requirements

Reasoning: The candidate's response demonstrates clear and concise verbal communication skills. They have accurately and comprehensively addressed the topic of secure authentication and provided good examples of when to use OAuth or JWT, indicating a strong understanding of these authentication protocols and their use cases. The response is concise and to the point, covering all relevant points without unnecessary detail, and the candidate has provided a clear and precise answer to the question, demonstrating good depth and breadth of knowledge.",What do you do when you feel overwhelmed with work?,Candidate Interest: How much interest did the candidate show in the position and the organization?,"""I take a step back, prioritize tasks, and seek help if needed.""",1,"1 - Significant Gap

The candidate's response does not provide any indication of their interest in the position or the organization. While the response may be relevant to the question ""How do you manage a heavy workload?"", it does not address the specific prompt to evaluate their interest in the position and the organization. There is no mention of the position or the organization in the response, and it does not provide any insight into the candidate's interest or motivation.",Explain Big-O notation.,Knowledge of Organization: Did the candidate research the organization prior to the interview?,"""Big-O notation is used to analyze the efficiency of algorithms, mainly their worst-case time and space complexity.""",3,"Rating: 3 - Meets Requirements

Reasoning: The candidate's response demonstrates a basic understanding of Big-O notation, which is relevant to software development and algorithm analysis. However, the response does not specifically mention the organization or show that the candidate has researched the organization prior to the interview. A stronger response would include specific details or examples related to the organization's work or practices, demonstrating a deeper level of research and understanding.",How do you handle failure?,"Teambuilding/Interpersonal Skills: Did the candidate demonstrate, through their answers, good teambuilding/interpersonal skills?","""I try to analyze what went wrong, learn from it, and apply those lessons moving forward.""",2,"Rating: 2 - Below Requirements

Reasoning: While the response demonstrates a degree of self-awareness and a willingness to learn from mistakes, it does not specifically address teambuilding or interpersonal skills. The candidate does not mention how they would interact with a team, resolve conflicts, or contribute to a positive and collaborative work environment. The response focuses more on individual actions rather than teamwork and interpersonal dynamics, which are crucial aspects of the category being evaluated.",Have you ever had to mentor someone? How did you approach it?,"Initiative: – Did the candidate demonstrate, through their answers, a high degree of initiative?","""Yes, I’ve helped junior colleagues by sharing knowledge and guiding them through tasks.""",3,"Rating: 3 - Meets Requirements.

Reasoning: The candidate's response demonstrates a moderate level of initiative. They have shown that they are willing to take the initiative to help junior colleagues by sharing knowledge and providing guidance. This indicates that they are proactive and willing to go beyond their own responsibilities to contribute to the team's success. However, the response lacks specific details and depth that would indicate a higher level of initiative.",Why do you want to work at this company?,"Time Management: Did the candidate demonstrate, through their answers, good time management skills?","""I’m really interested in the work this company does, and I think it aligns with my skills.""",1,"Rating: 1 - Significant Gap

Reasoning: While the candidate expresses interest in the company's work and believes that their skills align, this response does not demonstrate or provide any indication of the candidate's time management skills. The answer lacks clarity, relevance, and depth in relation to the category of time management.",What’s the most difficult problem you’ve had to solve in your career?,Attention to Detail: Was the candidate able to give provide examples of detail in their previous work experience?,"""I had to debug a complex issue in a system, and it took a lot of testing and troubleshooting.""",2,"Numerical rating: 2 - Below Requirements

Reasoning: While the candidate mentions a situation that required attention to detail (debugging a complex issue), the response lacks the necessary depth and clarity to meet the requirements fully. The candidate does not provide specific examples or explain the steps they took to test and troubleshoot the issue. Without additional details, it is challenging to assess the candidate's ability to provide examples of attention to detail in their previous work experience accurately.",Advance with reservations,"Final Decision: Advance with Reservations

Reasoning: While the candidate has demonstrated impressive verbal communication skills and a basic understanding of relevant technical concepts, there are significant gaps and below-requirement ratings in several key categories. The most concerning areas are Educational Background, Job/Organizational Fit, Problem-Solving, Candidate Interest, Time Management, and Attention to Detail. 

The candidate's responses lacked clarity and depth in these areas, indicating a need for further evaluation and clarification. However, their strong verbal communication skills and moderate initiative merit further consideration. Therefore, advancing with reservations is warranted, pending additional interviews or assessments to address the identified gaps and confirm their fit for the position."
1,Confident,How do you handle stress and tight deadlines?,Educational Background: Does the candidate have the appropriate educational qualifications or training for this position?,"""I manage stress by staying organized, breaking tasks into manageable parts, and maintaining clear communication to ensure deadlines are met efficiently.""",2,"Rating: 2 - Below Requirements

Reasoning: While the response provided touches on a valuable skill for any role, it does not address the candidate's educational background or qualifications. It seems the response may have been given for a different prompt, and as such, does not provide insight into the candidate's educational qualifications or training. To improve this rating, the candidate would need to provide an answer that directly addresses their educational background and how it relates to the position they are applying for.",What do you consider your biggest professional achievement?,Job/Organizational Fit: Has the candidate acquired similar skills or qualifications through past work experiences?,"""My biggest achievement was designing and implementing a scalable system that improved efficiency by 50%, benefiting thousands of users.""",4,"Rating: 4 - Exceeds Requirements

Reasoning: The candidate's response clearly demonstrates that they have acquired relevant skills and qualifications through past work experiences. They designed and implemented a scalable system that significantly improved efficiency, which indicates a strong understanding of system design and optimization. Additionally, the impact of their work (""benefiting thousands of users"") suggests that they have experience working on large-scale projects with substantial impact. 

However, the response could have provided more depth and detail regarding the specific skills acquired and the challenges overcome during the design and implementation process. Elaborating on these aspects would have given a more comprehensive understanding of the candidate's capabilities and how they could contribute to similar initiatives in the future.",What’s your leadership style?,Problem Solving: Did the candidate display the ability to react to a situation and devise a strategy?,"""I lead by example, fostering collaboration, empowering team members, and ensuring clear direction and support for success.""",3,"Rating: 3 - Meets Requirements. 

The response touches on the ability to lead and guide a team, which can be relevant to problem-solving, yet it does not explicitly provide a strategy or example of how the candidate would react to a specific situation. The response could benefit from clarity and depth by including a specific instance where the candidate demonstrated problem-solving skills and devised a strategy to overcome a challenge.",How would you implement authentication in a web application?,Verbal Communication: How were the candidate’s communication skills during the interview?,"""I would implement authentication using OAuth 2.0, JWTs, and secure password hashing with bcrypt to ensure security.""",4,"Rating: 4 - Exceeds Requirements

Reasoning: The candidate demonstrates clear and concise verbal communication skills in this response. They explain the implementation of authentication securely and effectively, showing a good understanding of the topic. The answer is relevant and provides depth by mentioning specific protocols and techniques (OAuth 2.0, JWTs, bcrypt). 

However, a deeper dive into the reasoning behind each choice or a broader explanation of the overall strategy could have been beneficial, which could have elevated the response to a 5. Nonetheless, this response is a good example of clear and confident communication during an interview.",What do you do when you feel overwhelmed with work?,Candidate Interest: How much interest did the candidate show in the position and the organization?,"""I break tasks into manageable steps, delegate when possible, and use structured approaches to stay on top of my workload.""",4,"Rating: 4 - Exceeds Requirements

Reasoning: The candidate demonstrates a clear understanding of task management and workload prioritization, which shows their interest in being well-organized and efficient in their work. They explain their approach to staying on top of tasks, which includes breaking down tasks into manageable steps and delegating when necessary. This response is relevant and provides good examples, showing that the candidate has put thought into their workflow and has a structured approach to their work. However, the response could have been more comprehensive by including specific examples or detailing further how this approach would benefit the position they are interviewing for, which would have elevated it to a 5 rating.",Explain Big-O notation.,Knowledge of Organization: Did the candidate research the organization prior to the interview?,"""Big-O notation describes the worst-case time and space complexity of an algorithm, helping engineers evaluate performance.""",3,"Rating: 3 - Meets Requirements.

Reasoning: The candidate demonstrates a basic understanding of Big-O notation, which is relevant to software engineering and could be applicable to the organization. However, the response lacks depth and does not specifically mention or tie back to the organization's work, mission, or any prior research conducted. A stronger response would have linked this knowledge to the organization's goals or provided examples of how Big-O notation could be beneficial in the context of the company's projects or products.",How do you handle failure?,"Teambuilding/Interpersonal Skills: Did the candidate demonstrate, through their answers, good teambuilding/interpersonal skills?","""I view failure as a learning opportunity, analyzing mistakes and improving my approach to ensure better outcomes in the future.""",2,"2 - Below Requirements.

Reasoning: While the candidate's response demonstrates a positive outlook on failure and a willingness to learn from mistakes, it does not directly address teambuilding or interpersonal skills. The candidate could further elaborate on how they work with a team to overcome challenges and resolve conflicts, which would provide a better understanding of their teambuilding abilities.",Have you ever had to mentor someone? How did you approach it?,"Initiative: – Did the candidate demonstrate, through their answers, a high degree of initiative?","""I’ve mentored junior developers, providing structured guidance, knowledge-sharing sessions, and code reviews to help them grow.""",3,"3 - Meets Requirements

The response demonstrates an initiative to take on mentorship responsibilities and share knowledge with junior developers. The candidate has taken the initiative to provide structured guidance and conduct knowledge-sharing sessions, which indicates a willingness to go beyond their immediate job responsibilities and contribute to the team's growth. However, the response could have been more impactful if it included specific details about the impact of their mentorship or any improvements they implemented in the mentorship process, which would demonstrate a higher level of initiative and a more significant contribution to the team's development.",Why do you want to work at this company?,"Time Management: Did the candidate demonstrate, through their answers, good time management skills?","""I admire this company's mission and culture, and I believe my skills in [relevant area] would contribute to its success.""",1,"Numerical rating: 1 - Significant Gap.

Brief reasoning: While the candidate expresses admiration for the company and believes in their ability to contribute, the response does not demonstrate an understanding of time management skills or provide any relevant examples that showcase their ability to manage time effectively. The answer lacks clarity, relevance, and depth in terms of time management, which is the category being evaluated.",What’s the most difficult problem you’ve had to solve in your career?,Attention to Detail: Was the candidate able to give provide examples of detail in their previous work experience?,"""I tackled a production outage where a rare concurrency issue caused failures. I identified the root cause, deployed a fix, and implemented monitoring to prevent future issues.""",4,"Rating: 4 - Exceeds Requirements. 

The candidate provides a clear and concise example of their ability to identify and resolve a complex technical issue, demonstrating their attention to detail. They identify a rare concurrency issue, suggesting an ability to notice small details that may have larger implications. 

However, the response does not go into depth about the specific details of the fix implemented or the monitoring system put in place. While the candidate demonstrates an understanding of the broader picture and shows an ability to identify and address issues, a deeper explanation of the specific steps taken would elevate this response to a perfect score. Nonetheless, the example provided is relevant and showcases the candidate's ability to provide attention to detail in a meaningful way.",Advance with reservations,"Final Decision: Advance with Reservations

Reasoning: Overall, the candidate demonstrates strong potential with ratings predominantly in the 3-4 range (""Meets Requirements"" to ""Exceeds Requirements""). Their responses showcase a clear understanding of relevant technical concepts, effective verbal communication skills, and a structured approach to task management and problem-solving. 

However, there are two areas of concern that warrant reservations. Firstly, the candidate's educational background does not appear to meet the requirements for the position, receiving a rating of 2 (""Below Requirements""). This is a critical aspect, and the absence of the necessary educational qualifications could be a significant disadvantage. Secondly, the candidate's response regarding teambuilding/interpersonal skills also received a low rating of 2 (""Below Requirements""). Given the importance of teamwork and collaboration in most organizations, this could be another area of improvement. 

Despite these reservations, the candidate's strengths in other areas, such as job/organizational fit, verbal communication, attention to detail, and initiative, suggest that they have valuable skills and knowledge to contribute. Therefore, advancing this candidate to the next stage of the interview process, with reservations, is recommended. To address the concerns, the hiring team may consider further evaluating the candidate's educational background to understand if there are transferable qualifications or experiences that could compensate for the lack of direct educational requirements. Additionally, behavioral or scenario-based interview questions could be designed to specifically assess the candidate's teambuilding and interpersonal skills, providing a more comprehensive understanding of their abilities in this area."
